{
  "$schema": "http://json-schema.org/draft-07/schema#",
  "$id": "https://osf-schemas/validation/business-profile-schema.json",
  "title": "OSF Business Profile (v3, IT-Edge Welle 1)",
  "description": "Schema for files under profiles/business/*.json — used by IT-Edges (PostgreSQL pollers) to type event-world entities. Strict separation from telemetry (machine BDE/ProcessData).",
  "type": "object",
  "required": [
    "profileId",
    "version",
    "displayName",
    "category",
    "attributes",
    "kgNodeLabel",
    "kgIdProperty"
  ],
  "properties": {
    "profileId": {
      "type": "string",
      "pattern": "^SMProfile-[A-Z][A-Za-z0-9]+$",
      "description": "Globally unique profile ID, prefix SMProfile-"
    },
    "version": {
      "type": "string",
      "pattern": "^[0-9]+\\.[0-9]+\\.[0-9]+$"
    },
    "standard": {
      "type": "string",
      "enum": [
        "CESMII",
        "OSF",
        "ISA-95"
      ]
    },
    "displayName": {
      "type": "string"
    },
    "category": {
      "type": "string",
      "enum": [
        "business"
      ],
      "description": "Business profiles only — telemetry profiles live in profiles/machines/."
    },
    "description": {
      "type": "string"
    },
    "parentType": {
      "type": [
        "string",
        "null"
      ]
    },
    "abstract": {
      "type": "boolean",
      "description": "Abstract parent profiles (e.g. SMProfile-Order) are not instantiated directly; concrete children declare parentType to inherit attributes. Mirrors the same flag on machine-profile-schema.json."
    },
    "attributes": {
      "type": "array",
      "minItems": 1,
      "items": {
        "type": "object",
        "required": [
          "name",
          "dataType",
          "category",
          "delivery",
          "scope",
          "promotion"
        ],
        "properties": {
          "name": {
            "type": "string"
          },
          "dataType": {
            "type": "string",
            "enum": [
              "String",
              "Int32",
              "Int64",
              "Float",
              "Double",
              "Boolean",
              "DateTime",
              "Json"
            ]
          },
          "category": {
            "type": "string"
          },
          "isKey": {
            "type": "boolean"
          },
          "description": {
            "type": "string"
          },
          "enum": {
            "type": "array"
          },
          "unit": {
            "type": "string"
          },
          "delivery": {
            "type": "string",
            "enum": [
              "telemetry",
              "transactional"
            ],
            "description": "Wire-Klasse. Bei business-Profilen per Konvention immer 'transactional' (JetStream Pub-Ack + Outbox-Retry) — trotzdem required, kein Default."
          },
          "scope": {
            "type": "string",
            "enum": [
              "edge",
              "hub"
            ],
            "description": "Scope. Bei business-Profilen per Konvention immer 'hub' (Event-Welt landet auf der .150) — trotzdem required, kein Default."
          },
          "promotion": {
            "type": "string",
            "description": "Promotion-Trigger / Emissions-Kadenz (Edge-agnostisch; IT- und OT-Edge interpretieren promotion IDENTISCH). IT-Edge-Attribute sind typ. on_change (Poller erkennt Aenderung). on_event = ereignisgetrieben. never = nie eine Hub-Emission (bleibt im Payload/Snapshot, ist aber aus dem Change-Trigger ausgenommen und wird nie allein publiziert — z.B. volatile updated_at-Server-Timestamps, die bei jedem GET frisch zurueckkommen). Nsec/Nmin (kanonisch, z.B. 5sec, 1min) = periodische Emission alle N Sekunden/Minuten, Grammatik ^[0-9]+(sec|min)$ (N>=1). required, kein Default.",
            "oneOf": [
              {
                "enum": [
                  "raw",
                  "aggregate",
                  "on_change",
                  "on_cycle_end",
                  "on_event",
                  "never"
                ]
              },
              {
                "pattern": "^[0-9]+(sec|min)$"
              }
            ]
          }
        },
        "additionalProperties": false
      }
    },
    "relationships": {
      "type": "array",
      "items": {
        "type": "object",
        "required": [
          "type",
          "target"
        ],
        "properties": {
          "type": {
            "type": "string"
          },
          "target": {
            "type": "string"
          },
          "targetIdProp": {
            "type": "string"
          },
          "timeBounded": {
            "type": "boolean"
          },
          "description": {
            "type": "string"
          }
        },
        "additionalProperties": false
      }
    },
    "kgNodeLabel": {
      "type": "string"
    },
    "kgIdProperty": {
      "type": "string"
    },
    "isa95": {
      "type": "object",
      "description": "ISA-95/MOM-Alignment (additiv): Part-2-Objektmodell + Part-3-MOM-Domäne. objectModel 'Extension' = Standard kennt das Objekt nicht.",
      "additionalProperties": false,
      "required": [
        "objectModel"
      ],
      "properties": {
        "objectModel": {
          "type": "string",
          "minLength": 1
        },
        "equipmentClass": {
          "type": "string"
        },
        "equipmentLevel": {
          "type": "string",
          "enum": [
            "Enterprise",
            "Site",
            "Area",
            "ProcessCell",
            "Unit",
            "ProductionLine",
            "WorkCell",
            "ProductionUnit",
            "StorageZone",
            "StorageUnit",
            "WorkCenter",
            "WorkUnit"
          ]
        },
        "level": {
          "type": "integer",
          "enum": [
            2,
            3,
            4
          ]
        },
        "momDomain": {
          "type": "string",
          "enum": [
            "production",
            "quality",
            "inventory",
            "maintenance"
          ]
        },
        "extension": {
          "type": "boolean"
        },
        "note": {
          "type": "string"
        },
        "propertyMap": {
          "type": "object",
          "additionalProperties": {
            "type": "string"
          }
        }
      }
    }
  },
  "additionalProperties": false
}