{
  "profileId": "SMProfile-Order",
  "version": "3.0.0",
  "standard": "CESMII",
  "displayName": "Order (Abstract Parent)",
  "category": "business",
  "description": "Abstract parent profile for all order types — defines common order attributes inherited by CustomerOrder, ProductionOrder, PurchaseOrder, MaintenanceOrder",
  "parentType": null,
  "abstract": true,
  "attributes": [
    {
      "name": "order_no",
      "dataType": "String",
      "category": "Core",
      "isKey": true,
      "description": "Unique order number",
      "delivery": "transactional",
      "scope": "hub",
      "promotion": "on_change"
    },
    {
      "name": "status",
      "dataType": "String",
      "category": "Core",
      "description": "Current order status",
      "delivery": "transactional",
      "scope": "hub",
      "promotion": "on_change"
    }
  ],
  "relationships": [],
  "kgNodeLabel": "Order",
  "kgIdProperty": "order_no",
  "isa95": {
    "objectModel": "Extension",
    "extension": true,
    "note": "abstrakter Order-Parent — konkrete Kinder tragen das Mapping",
    "level": 4
  }
}