{
  "profileId": "SMProfile-KPIDef",
  "version": "3.0.0",
  "standard": "CESMII",
  "displayName": "KPI Definition (OTD per Customer)",
  "description": "Liefertreue-KPI pro Kunde",
  "parentType": null,
  "attributes": [
    {
      "name": "customer_name",
      "dataType": "String",
      "category": "Reference",
      "delivery": "transactional",
      "scope": "hub",
      "promotion": "on_change"
    },
    {
      "name": "orders_total",
      "dataType": "Int32",
      "category": "Metric",
      "delivery": "transactional",
      "scope": "hub",
      "promotion": "on_change"
    },
    {
      "name": "orders_on_time",
      "dataType": "Int32",
      "category": "Metric",
      "delivery": "transactional",
      "scope": "hub",
      "promotion": "on_change"
    },
    {
      "name": "orders_late",
      "dataType": "Int32",
      "category": "Metric",
      "delivery": "transactional",
      "scope": "hub",
      "promotion": "on_change"
    },
    {
      "name": "otd_percentage",
      "dataType": "Float",
      "category": "Metric",
      "delivery": "transactional",
      "scope": "hub",
      "promotion": "on_change"
    }
  ],
  "relationships": [],
  "kgNodeLabel": "KPIDef",
  "kgIdProperty": "kpi_id",
  "category": "business",
  "isa95": {
    "objectModel": "Extension",
    "extension": true,
    "note": "KPI-Definition → ISO 22400, nicht ISA-95 Part 2"
  }
}