{
  "profileId": "SMProfile-MaintenanceNotification",
  "version": "3.0.0",
  "standard": "CESMII",
  "displayName": "Maintenance Notification",
  "description": "Instandhaltungsmeldung (Störung/Wartung/Inspektion)",
  "parentType": null,
  "attributes": [
    {
      "name": "machine_no",
      "dataType": "String",
      "category": "Reference",
      "delivery": "transactional",
      "scope": "hub",
      "promotion": "on_change"
    },
    {
      "name": "notification_type",
      "dataType": "String",
      "category": "Master",
      "delivery": "transactional",
      "scope": "hub",
      "promotion": "on_change"
    },
    {
      "name": "priority",
      "dataType": "String",
      "category": "Master",
      "delivery": "transactional",
      "scope": "hub",
      "promotion": "on_change"
    },
    {
      "name": "status",
      "dataType": "String",
      "category": "Status",
      "delivery": "transactional",
      "scope": "hub",
      "promotion": "on_change"
    },
    {
      "name": "description",
      "dataType": "String",
      "category": "Master",
      "delivery": "transactional",
      "scope": "hub",
      "promotion": "on_change"
    },
    {
      "name": "downtime_minutes",
      "dataType": "Int32",
      "category": "Impact",
      "delivery": "transactional",
      "scope": "hub",
      "promotion": "on_change"
    },
    {
      "name": "root_cause",
      "dataType": "String",
      "category": "Analysis",
      "delivery": "transactional",
      "scope": "hub",
      "promotion": "on_change"
    },
    {
      "name": "reported_by",
      "dataType": "String",
      "category": "Master",
      "delivery": "transactional",
      "scope": "hub",
      "promotion": "on_change"
    }
  ],
  "relationships": [
    {
      "type": "FOR_MACHINE",
      "target": "Machine"
    }
  ],
  "kgNodeLabel": "MaintenanceNotification",
  "kgIdProperty": "notification_no",
  "category": "business"
}
