{
  "profileId": "SMProfile-DowntimeRecord",
  "version": "3.0.0",
  "standard": "CESMII",
  "displayName": "Downtime Record",
  "description": "Stillstandsereignis einer Maschine aus BDE-Daten",
  "parentType": null,
  "attributes": [
    {
      "name": "machine_id",
      "dataType": "String",
      "category": "Reference",
      "delivery": "transactional",
      "scope": "hub",
      "promotion": "on_change"
    },
    {
      "name": "machine_name",
      "dataType": "String",
      "category": "Reference",
      "delivery": "transactional",
      "scope": "hub",
      "promotion": "on_change"
    },
    {
      "name": "reason",
      "dataType": "String",
      "category": "Master",
      "delivery": "transactional",
      "scope": "hub",
      "promotion": "on_change"
    },
    {
      "name": "duration_sec",
      "dataType": "Int32",
      "category": "Metric",
      "delivery": "transactional",
      "scope": "hub",
      "promotion": "on_change"
    },
    {
      "name": "shift_number",
      "dataType": "Int32",
      "category": "Context",
      "delivery": "transactional",
      "scope": "hub",
      "promotion": "on_change"
    },
    {
      "name": "recorded_at",
      "dataType": "String",
      "category": "Time",
      "delivery": "transactional",
      "scope": "hub",
      "promotion": "on_change"
    }
  ],
  "relationships": [
    {
      "type": "HAD_DOWNTIME",
      "target": "Machine"
    }
  ],
  "kgNodeLabel": "DowntimeRecord",
  "kgIdProperty": "downtime_id",
  "category": "business"
}
